{
  "id": 15,
  "difficulty": 0.4,
  "optimal": 13,
  "grid": {
    "cols": 8,
    "rows": 8
  },
  "buses": [
    {
      "id": "bus1",
      "x": 0,
      "y": 2,
      "color": "yellow",
      "passengers": 0,
      "capacity": 4,
      "direction": "right"
    },
    {
      "id": "bus2",
      "x": 0,
      "y": 6,
      "color": "purple",
      "passengers": 0,
      "capacity": 4,
      "direction": "right"
    },
    {
      "id": "bus3",
      "x": 4,
      "y": 0,
      "color": "orange",
      "passengers": 0,
      "capacity": 3,
      "direction": "down"
    }
  ],
  "stops": [
    {
      "x": 2,
      "y": 1,
      "color": "yellow",
      "waiting": [
        "yellow",
        "yellow",
        "yellow",
        "yellow"
      ]
    },
    {
      "x": 2,
      "y": 7,
      "color": "purple",
      "waiting": [
        "purple",
        "purple",
        "purple",
        "purple"
      ]
    },
    {
      "x": 6,
      "y": 4,
      "color": "orange",
      "waiting": [
        "orange",
        "orange",
        "orange"
      ]
    }
  ],
  "exits": [
    {
      "x": 7,
      "y": 2
    },
    {
      "x": 7,
      "y": 6
    },
    {
      "x": 4,
      "y": 7
    }
  ],
  "roads": [
    [
      0,
      2
    ],
    [
      1,
      2
    ],
    [
      2,
      2
    ],
    [
      3,
      2
    ],
    [
      4,
      2
    ],
    [
      5,
      2
    ],
    [
      6,
      2
    ],
    [
      7,
      2
    ],
    [
      2,
      1
    ],
    [
      0,
      6
    ],
    [
      1,
      6
    ],
    [
      2,
      6
    ],
    [
      3,
      6
    ],
    [
      4,
      6
    ],
    [
      5,
      6
    ],
    [
      6,
      6
    ],
    [
      7,
      6
    ],
    [
      2,
      7
    ],
    [
      4,
      0
    ],
    [
      4,
      1
    ],
    [
      4,
      3
    ],
    [
      4,
      4
    ],
    [
      4,
      5
    ],
    [
      4,
      7
    ],
    [
      6,
      4
    ],
    [
      6,
      3
    ]
  ]
}