{
  "id": 7,
  "difficulty": 0.2,
  "optimal": 8,
  "grid": {
    "cols": 6,
    "rows": 6
  },
  "buses": [
    {
      "id": "bus1",
      "x": 0,
      "y": 2,
      "color": "yellow",
      "passengers": 0,
      "capacity": 4,
      "direction": "right"
    },
    {
      "id": "bus2",
      "x": 5,
      "y": 3,
      "color": "purple",
      "passengers": 0,
      "capacity": 3,
      "direction": "left"
    }
  ],
  "stops": [
    {
      "x": 2,
      "y": 1,
      "color": "yellow",
      "waiting": [
        "yellow",
        "yellow",
        "yellow",
        "yellow"
      ]
    },
    {
      "x": 3,
      "y": 4,
      "color": "purple",
      "waiting": [
        "purple",
        "purple",
        "purple"
      ]
    }
  ],
  "exits": [
    {
      "x": 5,
      "y": 2
    },
    {
      "x": 0,
      "y": 3
    }
  ],
  "roads": [
    [
      0,
      2
    ],
    [
      1,
      2
    ],
    [
      2,
      2
    ],
    [
      3,
      2
    ],
    [
      4,
      2
    ],
    [
      5,
      2
    ],
    [
      2,
      1
    ],
    [
      5,
      3
    ],
    [
      4,
      3
    ],
    [
      3,
      3
    ],
    [
      2,
      3
    ],
    [
      1,
      3
    ],
    [
      0,
      3
    ],
    [
      3,
      4
    ]
  ]
}