{
  "id": 28,
  "difficulty": 0.72,
  "optimal": 19,
  "grid": {
    "cols": 10,
    "rows": 10
  },
  "buses": [
    {
      "id": "bus1",
      "x": 1,
      "y": 3,
      "color": "green",
      "passengers": 0,
      "capacity": 4,
      "direction": "right"
    },
    {
      "id": "bus2",
      "x": 5,
      "y": 1,
      "color": "yellow",
      "passengers": 0,
      "capacity": 4,
      "direction": "down"
    },
    {
      "id": "bus3",
      "x": 8,
      "y": 6,
      "color": "purple",
      "passengers": 0,
      "capacity": 4,
      "direction": "left"
    },
    {
      "id": "bus4",
      "x": 4,
      "y": 8,
      "color": "orange",
      "passengers": 0,
      "capacity": 4,
      "direction": "up"
    }
  ],
  "stops": [
    {
      "x": 3,
      "y": 2,
      "color": "green",
      "waiting": [
        "green",
        "green",
        "green",
        "green"
      ]
    },
    {
      "x": 6,
      "y": 4,
      "color": "yellow",
      "waiting": [
        "yellow",
        "yellow",
        "yellow",
        "yellow"
      ]
    },
    {
      "x": 6,
      "y": 7,
      "color": "purple",
      "waiting": [
        "purple",
        "purple",
        "purple",
        "purple"
      ]
    },
    {
      "x": 2,
      "y": 5,
      "color": "orange",
      "waiting": [
        "orange",
        "orange",
        "orange",
        "orange"
      ]
    }
  ],
  "exits": [
    {
      "x": 9,
      "y": 3
    },
    {
      "x": 5,
      "y": 0
    },
    {
      "x": 0,
      "y": 6
    },
    {
      "x": 4,
      "y": 9
    }
  ],
  "roads": [
    [
      0,
      3
    ],
    [
      1,
      3
    ],
    [
      2,
      3
    ],
    [
      3,
      3
    ],
    [
      4,
      3
    ],
    [
      5,
      3
    ],
    [
      6,
      3
    ],
    [
      7,
      3
    ],
    [
      8,
      3
    ],
    [
      9,
      3
    ],
    [
      3,
      2
    ],
    [
      5,
      1
    ],
    [
      5,
      2
    ],
    [
      5,
      4
    ],
    [
      5,
      5
    ],
    [
      5,
      6
    ],
    [
      5,
      7
    ],
    [
      5,
      8
    ],
    [
      6,
      4
    ],
    [
      8,
      6
    ],
    [
      7,
      6
    ],
    [
      6,
      6
    ],
    [
      6,
      7
    ],
    [
      4,
      8
    ],
    [
      4,
      7
    ],
    [
      4,
      6
    ],
    [
      4,
      5
    ],
    [
      4,
      4
    ],
    [
      4,
      9
    ],
    [
      2,
      5
    ],
    [
      3,
      5
    ],
    [
      5,
      0
    ]
  ]
}