{
  "id": 16,
  "difficulty": 0.42,
  "optimal": 13,
  "grid": {
    "cols": 8,
    "rows": 8
  },
  "buses": [
    {
      "id": "bus1",
      "x": 2,
      "y": 2,
      "color": "red",
      "passengers": 0,
      "capacity": 4,
      "direction": "right"
    },
    {
      "id": "bus2",
      "x": 5,
      "y": 5,
      "color": "blue",
      "passengers": 0,
      "capacity": 4,
      "direction": "left"
    }
  ],
  "stops": [
    {
      "x": 1,
      "y": 1,
      "color": "red",
      "waiting": [
        "red",
        "red",
        "red",
        "red"
      ]
    },
    {
      "x": 6,
      "y": 6,
      "color": "blue",
      "waiting": [
        "blue",
        "blue",
        "blue",
        "blue"
      ]
    }
  ],
  "exits": [
    {
      "x": 7,
      "y": 2
    },
    {
      "x": 0,
      "y": 5
    }
  ],
  "roads": [
    [
      2,
      2
    ],
    [
      3,
      2
    ],
    [
      4,
      2
    ],
    [
      5,
      2
    ],
    [
      6,
      2
    ],
    [
      7,
      2
    ],
    [
      1,
      1
    ],
    [
      2,
      1
    ],
    [
      5,
      5
    ],
    [
      4,
      5
    ],
    [
      3,
      5
    ],
    [
      2,
      5
    ],
    [
      1,
      5
    ],
    [
      0,
      5
    ],
    [
      6,
      6
    ],
    [
      6,
      5
    ]
  ]
}