{
  "id": 26,
  "difficulty": 0.68,
  "optimal": 18,
  "grid": {
    "cols": 10,
    "rows": 10
  },
  "buses": [
    {
      "id": "bus1",
      "x": 0,
      "y": 4,
      "color": "red",
      "passengers": 0,
      "capacity": 4,
      "direction": "right"
    },
    {
      "id": "bus2",
      "x": 9,
      "y": 5,
      "color": "blue",
      "passengers": 0,
      "capacity": 4,
      "direction": "left"
    },
    {
      "id": "bus3",
      "x": 4,
      "y": 0,
      "color": "green",
      "passengers": 0,
      "capacity": 4,
      "direction": "down"
    },
    {
      "id": "bus4",
      "x": 5,
      "y": 9,
      "color": "yellow",
      "passengers": 0,
      "capacity": 4,
      "direction": "up"
    }
  ],
  "stops": [
    {
      "x": 2,
      "y": 3,
      "color": "red",
      "waiting": [
        "red",
        "red",
        "red",
        "red"
      ]
    },
    {
      "x": 7,
      "y": 6,
      "color": "blue",
      "waiting": [
        "blue",
        "blue",
        "blue",
        "blue"
      ]
    },
    {
      "x": 3,
      "y": 2,
      "color": "green",
      "waiting": [
        "green",
        "green",
        "green",
        "green"
      ]
    },
    {
      "x": 6,
      "y": 7,
      "color": "yellow",
      "waiting": [
        "yellow",
        "yellow",
        "yellow",
        "yellow"
      ]
    }
  ],
  "exits": [
    {
      "x": 9,
      "y": 4
    },
    {
      "x": 0,
      "y": 5
    },
    {
      "x": 4,
      "y": 0
    },
    {
      "x": 5,
      "y": 9
    }
  ],
  "roads": [
    [
      0,
      4
    ],
    [
      1,
      4
    ],
    [
      2,
      4
    ],
    [
      3,
      4
    ],
    [
      4,
      4
    ],
    [
      5,
      4
    ],
    [
      6,
      4
    ],
    [
      7,
      4
    ],
    [
      8,
      4
    ],
    [
      9,
      4
    ],
    [
      2,
      3
    ],
    [
      9,
      5
    ],
    [
      8,
      5
    ],
    [
      7,
      5
    ],
    [
      6,
      5
    ],
    [
      5,
      5
    ],
    [
      4,
      5
    ],
    [
      3,
      5
    ],
    [
      2,
      5
    ],
    [
      1,
      5
    ],
    [
      0,
      5
    ],
    [
      7,
      6
    ],
    [
      4,
      0
    ],
    [
      4,
      1
    ],
    [
      4,
      2
    ],
    [
      4,
      3
    ],
    [
      4,
      6
    ],
    [
      4,
      7
    ],
    [
      4,
      8
    ],
    [
      4,
      9
    ],
    [
      3,
      2
    ],
    [
      5,
      9
    ],
    [
      5,
      8
    ],
    [
      5,
      7
    ],
    [
      5,
      6
    ],
    [
      5,
      3
    ],
    [
      5,
      2
    ],
    [
      5,
      1
    ],
    [
      5,
      0
    ],
    [
      6,
      7
    ]
  ]
}